{
  "schema_version": 1,
  "symbol": "CPALL",
  "company_code": "0737",
  "company_name_en": "CP All Public Company Limited",
  "company_name_th": "บริษัท ซีพี ออลล์ จำกัด (มหาชน)",
  "updated_at": "2026-02-25",
  "quarterly_history": {
    "2564": {
      "Q1": 2599.055,
      "Q2": 2189.699,
      "Q3": 1493.009,
      "Q4": 6703.716956999999,
      "FullYear": 12985.479957
    },
    "2565": {
      "Q1": 3453.025,
      "Q2": 3004.023,
      "Q3": 3676.932,
      "Q4": 3137.727922,
      "FullYear": 13271.707922
    },
    "2566": {
      "Q1": 4122.777,
      "Q2": 4438.406,
      "Q3": 4424.292,
      "Q4": 5496.656036999998,
      "FullYear": 18482.131037
    },
    "2567": {
      "Q1": 6319.396,
      "Q2": 6239.481,
      "Q3": 5607.864,
      "Q4": 7179.099862000001,
      "FullYear": 25345.840862
    },
    "2568": {
      "Q1": 7585.238,
      "Q2": 6768.455,
      "Q3": 6596.528,
      "Q4": 7255.879406,
      "FullYear": 28206.100406
    }
  },
  "sources": [
    {
      "year": 2564,
      "period": "9M",
      "filing_date": "2021-11-11",
      "news_id": "2021121289",
      "raw_path": "CPALL/financials/2564/9M/source.zip",
      "sha256": "fdbc9c7c8ae03697062a69767310dc8eb1536911375707748c56813ede50fe5b",
      "ingested_at": "2026-04-23T08:23:19+00:00",
      "shareholder_profit": 1493.009
    },
    {
      "year": 2564,
      "period": "FY",
      "filing_date": "2022-02-24",
      "news_id": "2022021349",
      "raw_path": "CPALL/financials/2564/FY/source.zip",
      "sha256": "24d44edf482b89361322ab861fd6ed005c0c864fcb5896495de2ec28c528abd3",
      "ingested_at": "2026-04-23T08:23:15+00:00",
      "shareholder_profit": 12985.479957
    },
    {
      "year": 2564,
      "period": "H1",
      "filing_date": "2021-08-11",
      "news_id": "2021087134",
      "raw_path": "CPALL/financials/2564/H1/source.zip",
      "sha256": "92ea5c18b313daba2f7869346196f5ffd40c14fce0af4aa5c9f823f4b0ac0f7f",
      "ingested_at": "2026-04-23T08:23:23+00:00",
      "shareholder_profit": 2189.699
    },
    {
      "year": 2564,
      "period": "Q1",
      "filing_date": "2021-05-12",
      "news_id": "2021054304",
      "raw_path": "CPALL/financials/2564/Q1/source.zip",
      "sha256": "d8743e6657f0e0bb2b8a5a38cdfd0cf16ecb8d9bde1b92f02bbb7ea588b30e43",
      "ingested_at": "2026-04-23T08:23:27+00:00",
      "shareholder_profit": 2599.055
    },
    {
      "year": 2565,
      "period": "9M",
      "filing_date": "2022-11-11",
      "news_id": "2022133388",
      "raw_path": "CPALL/financials/2565/9M/source.zip",
      "sha256": "6db3fab5ac761d7cd4d88b1c5ad0f378568a0cd51068669ea49932928d87fd25",
      "ingested_at": "2026-04-23T08:23:02+00:00",
      "shareholder_profit": 3676.932
    },
    {
      "year": 2565,
      "period": "FY",
      "filing_date": "2023-02-23",
      "news_id": "2023020281",
      "raw_path": "CPALL/financials/2565/FY/source.zip",
      "sha256": "e1a42e06986c481c8fc26b74f44aa1f31fbe1bd12a5fb4867262d399118523dd",
      "ingested_at": "2026-04-23T08:22:58+00:00",
      "shareholder_profit": 13271.707922
    },
    {
      "year": 2565,
      "period": "H1",
      "filing_date": "2022-08-10",
      "news_id": "2022092738",
      "raw_path": "CPALL/financials/2565/H1/source.zip",
      "sha256": "8c866c49cb041c65069083c2cbc818820fbd0f3bb47d2a752c9ed08ca81a7ab2",
      "ingested_at": "2026-04-23T08:23:06+00:00",
      "shareholder_profit": 3004.023
    },
    {
      "year": 2565,
      "period": "Q1",
      "filing_date": "2022-05-11",
      "news_id": "2022057605",
      "raw_path": "CPALL/financials/2565/Q1/source.zip",
      "sha256": "22edbd5144c55487c625d401eeeac0e822d9e64229d3881372b3d75c860ece99",
      "ingested_at": "2026-04-23T08:23:10+00:00",
      "shareholder_profit": 3453.025
    },
    {
      "year": 2566,
      "period": "9M",
      "filing_date": "2023-11-10",
      "news_id": "16995730753641",
      "raw_path": "CPALL/financials/2566/9M/source.zip",
      "sha256": "9925c3609631cd8428daec2acf1c04dab429db1186840a5cd9c560f40e09145c",
      "ingested_at": "2026-04-23T08:22:46+00:00",
      "shareholder_profit": 4424.292
    },
    {
      "year": 2566,
      "period": "FY",
      "filing_date": "2024-02-23",
      "news_id": "17086428995201",
      "raw_path": "CPALL/financials/2566/FY/source.zip",
      "sha256": "d00e1e42cfafce47cb7f35e5ee6cbf3cfdfa525d849183d148e4945f39ea65a6",
      "ingested_at": "2026-04-23T08:22:42+00:00",
      "shareholder_profit": 18482.131037
    },
    {
      "year": 2566,
      "period": "H1",
      "filing_date": "2023-08-10",
      "news_id": "16916230269381",
      "raw_path": "CPALL/financials/2566/H1/source.zip",
      "sha256": "596a1fc40d17d527506fcb2816e92bb6e537e412a6f6947c0750a574057b9ff8",
      "ingested_at": "2026-04-23T08:22:50+00:00",
      "shareholder_profit": 4438.406
    },
    {
      "year": 2566,
      "period": "Q1",
      "filing_date": "2023-05-10",
      "news_id": "16836750076361",
      "raw_path": "CPALL/financials/2566/Q1/source.zip",
      "sha256": "4224442c4998f3237c156915e14a77181e1b39657232ca9c31c4312321c3c5d8",
      "ingested_at": "2026-04-23T08:22:54+00:00",
      "shareholder_profit": 4122.777
    },
    {
      "year": 2567,
      "period": "9M",
      "filing_date": "2024-11-13",
      "news_id": "17314477491851",
      "raw_path": "CPALL/financials/2567/9M/source.zip",
      "sha256": "8c521162cfe670abe3ebdfed406d9bfcfd963437ad5342385ec7c1fff7d83642",
      "ingested_at": "2026-04-23T08:22:29+00:00",
      "shareholder_profit": 5607.864
    },
    {
      "year": 2567,
      "period": "FY",
      "filing_date": "2025-02-25",
      "news_id": "17404367155371",
      "raw_path": "CPALL/financials/2567/FY/source.zip",
      "sha256": "dd3f216adb9d93de84b1c6a7aef65ab1581716829c7b1966b7d9d486dafbabe9",
      "ingested_at": "2026-04-23T08:22:25+00:00",
      "shareholder_profit": 25345.840862
    },
    {
      "year": 2567,
      "period": "H1",
      "filing_date": "2024-08-13",
      "news_id": "17234990169831",
      "raw_path": "CPALL/financials/2567/H1/source.zip",
      "sha256": "83c0f1bd65b4ff113cfa07c5b1e7c6c6c17d959d7edb78b5587f139100a8614b",
      "ingested_at": "2026-04-23T08:22:33+00:00",
      "shareholder_profit": 6239.481
    },
    {
      "year": 2567,
      "period": "Q1",
      "filing_date": "2024-05-10",
      "news_id": "17152924566511",
      "raw_path": "CPALL/financials/2567/Q1/source.zip",
      "sha256": "04897f98811f0fb1ec8311923aa0deda135eed1863c0811f26df6158a74d6f1c",
      "ingested_at": "2026-04-23T08:22:38+00:00",
      "shareholder_profit": 6319.396
    },
    {
      "year": 2568,
      "period": "9M",
      "filing_date": "2025-11-12",
      "news_id": "17629001494161",
      "raw_path": "CPALL/financials/2568/9M/source.zip",
      "sha256": "1dcb3e14d7f599d341e05f0a22e7cd156977da1a5f69cb7039be8538f881cb13",
      "ingested_at": "2026-04-23T08:22:13+00:00",
      "shareholder_profit": 6596.528
    },
    {
      "year": 2568,
      "period": "FY",
      "filing_date": "2026-02-25",
      "news_id": "17719707026031",
      "raw_path": "CPALL/financials/2568/FY/source.zip",
      "sha256": "f1fdd0b6719af613ebe4fc35095b6fe87ac5a9934094d6d4ad16decb631fc3c3",
      "ingested_at": "2026-04-23T08:22:08+00:00",
      "shareholder_profit": 28206.100406
    },
    {
      "year": 2568,
      "period": "H1",
      "filing_date": "2025-08-13",
      "news_id": "17550361129791",
      "raw_path": "CPALL/financials/2568/H1/source.zip",
      "sha256": "b18f200026cdce8527deab73f93fa78f1a41b582691f8ffc6d065c1953126021",
      "ingested_at": "2026-04-23T08:22:17+00:00",
      "shareholder_profit": 6768.455
    },
    {
      "year": 2568,
      "period": "Q1",
      "filing_date": "2025-05-13",
      "news_id": "17470903517521",
      "raw_path": "CPALL/financials/2568/Q1/source.zip",
      "sha256": "048d6915afb438961cfe01993f639c1366a1cfcff9b9cebce45c5796f8ed14b9",
      "ingested_at": "2026-04-23T08:22:21+00:00",
      "shareholder_profit": 7585.238
    }
  ]
}