{
  "schema_version": 1,
  "symbol": "BLESS",
  "company_code": null,
  "company_name_en": null,
  "company_name_th": null,
  "updated_at": "2026-02-24",
  "quarterly_history": {
    "2564": {
      "Q1": null,
      "Q2": null,
      "Q3": null,
      "Q4": null,
      "FullYear": 80.07442575000009
    },
    "2565": {
      "Q1": 13.461376290000027,
      "Q2": 5.8009493300000115,
      "Q3": 6.858225010000005,
      "Q4": 16.275194539999855,
      "FullYear": 42.3957451699999
    },
    "2566": {
      "Q1": 4.953889,
      "Q2": 14.956814,
      "Q3": 0.262674,
      "Q4": -10.554774,
      "FullYear": 9.618603
    },
    "2567": {
      "Q1": -8.127731,
      "Q2": 4.153995,
      "Q3": 11.202794,
      "Q4": 0.7897610000000004,
      "FullYear": 8.018819
    },
    "2568": {
      "Q1": 5.057668,
      "Q2": 1.038459,
      "Q3": 4.983722,
      "Q4": -0.7533750000000001,
      "FullYear": 10.326474
    }
  },
  "sources": [
    {
      "year": 2564,
      "period": "FY",
      "filing_date": "2022-07-06",
      "news_id": "2022081209",
      "raw_path": "BLESS/financials/2564/FY/source.zip",
      "sha256": "41848134a0af826be8789f600c8b2a4401f6c7d40e56b99d476e4cde55c5cb89",
      "ingested_at": "2026-04-28T03:48:21+00:00",
      "shareholder_profit": 80.07442575000009
    },
    {
      "year": 2565,
      "period": "9M",
      "filing_date": "2022-11-11",
      "news_id": "2022134133",
      "raw_path": "BLESS/financials/2565/9M/source.zip",
      "sha256": "a9ff143543fd13fbd643dc24e76f81bd94ff48dcdb18169af72d52652336d782",
      "ingested_at": "2026-04-28T03:48:10+00:00",
      "shareholder_profit": 6.858225010000005
    },
    {
      "year": 2565,
      "period": "FY",
      "filing_date": "2023-02-22",
      "news_id": "2023019495",
      "raw_path": "BLESS/financials/2565/FY/source.zip",
      "sha256": "f48f8da999a71c304580dcb006e1f8d1fd7f13be52707cd8de30d10e5881f6ad",
      "ingested_at": "2026-04-28T03:48:06+00:00",
      "shareholder_profit": 42.3957451699999
    },
    {
      "year": 2565,
      "period": "H1",
      "filing_date": "2022-08-15",
      "news_id": "2022096952",
      "raw_path": "BLESS/financials/2565/H1/source.zip",
      "sha256": "1e2cfb5c95a1c8d8a701887f1ec624e35b0b06f4169002841e0f84cbf91e5635",
      "ingested_at": "2026-04-28T03:48:15+00:00",
      "shareholder_profit": 5.8009493300000115
    },
    {
      "year": 2565,
      "period": "Q1",
      "filing_date": "2022-07-06",
      "news_id": "2022081210",
      "raw_path": "BLESS/financials/2565/Q1/source.zip",
      "sha256": "afd14fa9d71e7969ca3279c7ca4b7f289cbddc8989a63c1fc0d3004c01c7e877",
      "ingested_at": "2026-04-28T03:48:26+00:00",
      "shareholder_profit": 13.461376290000027
    },
    {
      "year": 2566,
      "period": "9M",
      "filing_date": "2023-11-09",
      "news_id": "16994859293411",
      "raw_path": "BLESS/financials/2566/9M/source.zip",
      "sha256": "f8d099d39c8be6568386d60dc1dbad0f5f9e6a3daddedf38082905a81cabe89a",
      "ingested_at": "2026-04-28T03:47:51+00:00",
      "shareholder_profit": 0.262674
    },
    {
      "year": 2566,
      "period": "FY",
      "filing_date": "2024-02-29",
      "news_id": "17091569084081",
      "raw_path": "BLESS/financials/2566/FY/source.zip",
      "sha256": "82dd351578f10a931534ed4b7ba3d0ad41eef884247ab083ccf55341ccd2e007",
      "ingested_at": "2026-04-28T03:47:45+00:00",
      "shareholder_profit": 9.618603
    },
    {
      "year": 2566,
      "period": "H1",
      "filing_date": "2023-08-10",
      "news_id": "16916230308241",
      "raw_path": "BLESS/financials/2566/H1/source.zip",
      "sha256": "e0bcafae9c085acfa0d195bd6ba6d3a6abd3a7305f3abf92273fed96bd96d74a",
      "ingested_at": "2026-04-28T03:47:56+00:00",
      "shareholder_profit": 14.956814
    },
    {
      "year": 2566,
      "period": "Q1",
      "filing_date": "2023-05-11",
      "news_id": "16837584079971",
      "raw_path": "BLESS/financials/2566/Q1/source.zip",
      "sha256": "c17abbe75c3c3eb7bbea2ef91a23c0660c0b915793a06ced8110f12d976e92e6",
      "ingested_at": "2026-04-28T03:48:00+00:00",
      "shareholder_profit": 4.953889
    },
    {
      "year": 2567,
      "period": "9M",
      "filing_date": "2024-11-14",
      "news_id": "17315361297761",
      "raw_path": "BLESS/financials/2567/9M/source.zip",
      "sha256": "96876b1e0f301e9f45544097d728602af9be2b5c5e9c1589f84c01a371c52cfd",
      "ingested_at": "2026-04-28T03:47:30+00:00",
      "shareholder_profit": 11.202794
    },
    {
      "year": 2567,
      "period": "FY",
      "filing_date": "2025-02-25",
      "news_id": "17404367216561",
      "raw_path": "BLESS/financials/2567/FY/source.zip",
      "sha256": "807c5da0ae5ed5a1328b5080da1742543c70981b64ebae034c87543fd02fe843",
      "ingested_at": "2026-04-28T03:47:25+00:00",
      "shareholder_profit": 8.018819
    },
    {
      "year": 2567,
      "period": "H1",
      "filing_date": "2024-08-08",
      "news_id": "17230734215921",
      "raw_path": "BLESS/financials/2567/H1/source.zip",
      "sha256": "13cb8c1cfe340fa827eb220a058657e2222ba23b1cc87d1c91369ca59f1fa0bc",
      "ingested_at": "2026-04-28T03:47:35+00:00",
      "shareholder_profit": 4.153995
    },
    {
      "year": 2567,
      "period": "Q1",
      "filing_date": "2024-05-10",
      "news_id": "17152924602071",
      "raw_path": "BLESS/financials/2567/Q1/source.zip",
      "sha256": "eb875b9a501d99fe499e4034095334bd4fd8b4af31b336a3292aa682635cd043",
      "ingested_at": "2026-04-28T03:47:40+00:00",
      "shareholder_profit": -8.127731
    },
    {
      "year": 2568,
      "period": "9M",
      "filing_date": "2025-11-11",
      "news_id": "17628159934541",
      "raw_path": "BLESS/financials/2568/9M/source.zip",
      "sha256": "59fab91e576e4e4062f40fc10a1d88bd0bfc35da2863d778713c3355dd3c94e5",
      "ingested_at": "2026-04-28T03:47:09+00:00",
      "shareholder_profit": 4.983722
    },
    {
      "year": 2568,
      "period": "FY",
      "filing_date": "2026-02-24",
      "news_id": "17718892177451",
      "raw_path": "BLESS/financials/2568/FY/source.zip",
      "sha256": "bbb84193f258f7df374a502f3035bcaa1987836da66c099721c5fa32d74003c4",
      "ingested_at": "2026-04-28T03:47:04+00:00",
      "shareholder_profit": 10.326474
    },
    {
      "year": 2568,
      "period": "H1",
      "filing_date": "2025-08-13",
      "news_id": "17550361046541",
      "raw_path": "BLESS/financials/2568/H1/source.zip",
      "sha256": "52ee891436caaf8f8e86b25634dfb8f45ed30a88a258d60faf365ee369843def",
      "ingested_at": "2026-04-28T03:47:14+00:00",
      "shareholder_profit": 1.038459
    },
    {
      "year": 2568,
      "period": "Q1",
      "filing_date": "2025-05-13",
      "news_id": "17470903517541",
      "raw_path": "BLESS/financials/2568/Q1/source.zip",
      "sha256": "f2658f8677c86217e00eed4acf7aad26b95f8a53b8964d6efe3964cad769b375",
      "ingested_at": "2026-04-28T03:47:20+00:00",
      "shareholder_profit": 5.057668
    }
  ]
}